<?xml version="1.0" encoding="UTF-8"?>
<!DOCTYPE record SYSTEM "iwr3.dtd" >
<record>
  <world>
    <id>id</id>
    <name>name</name>
    <start>start</start>
    <width>width</width>
    <height>height</height>
    <limit>limit</limit>
    <map>
      <f>f</f>
    </map>
    <winner>winner</winner>
  </world>
  <wmod>
    <id>id</id>
    <name>name</name>
    <peace>peace</peace>
    <type>type</type>
    <timelimit>timelimit</timelimit>
    <mapvisafter>mapvisafter</mapvisafter>
    <speed>speed</speed>
    <prodef>prodef</prodef>
    <startturns>startturns</startturns>
    <startnectar>startnectar</startnectar>
    <rating>rating</rating>
    <jumping>jumping</jumping>
    <flags>flags</flags>
    <unitspeedbonus>unitspeedbonus</unitspeedbonus>
    <friendarmy>friendarmy</friendarmy>
  </wmod>
  <fieldtypes>
    <fieldtype>
      <id>id</id>
      <name>name</name>
      <armyvisible>armyvisible</armyvisible>
      <produce>produce</produce>
      <lookout>lookout</lookout>
      <attbonus>attbonus</attbonus>
      <defbonus>defbonus</defbonus>
      <reachability>reachability</reachability>
    </fieldtype>
  </fieldtypes>
  <map>
    <f>f</f>
  </map>
  <units>
    <unit>
      <id>id</id>
      <name>name</name>
      <desc>desc</desc>
      <att>
        <t>t</t>
        <p1>p1</p1>
        <p2>p2</p2>
        <ca>ca</ca>
        <ta>ta</ta>
        <cd>cd</cd>
        <td>td</td>
        <r>r</r>
        <s>s</s>
      </att>
      <def>def</def>
      <cost>cost</cost>
      <turnsatt>turnsatt</turnsatt>
      <turnsmove>turnsmove</turnsmove>
      <lobonus>lobonus</lobonus>
    </unit>
  </units>
  <players>
    <player>
      <id>id</id>
      <nick>nick</nick>
      <type>type</type>
      <ali>ali</ali>
      <regdate>regdate</regdate>
    </player>
  </players>
  <events>
    <ws>
      <t>t</t>
    </ws>
    <chq>
      <t>t</t>
      <pl>pl</pl>
      <p>p</p>
    </chq>
    <att>
      <t>t</t>
      <p1>p1</p1>
      <p2>p2</p2>
      <ca>ca</ca>
      <ta>ta</ta>
      <cd>cd</cd>
      <td>td</td>
      <r>r</r>
      <s>s</s>
    </att>
    <buy>
      <t>t</t>
      <p>p</p>
      <ut>ut</ut>
      <c>c</c>
    </buy>
  </events>
</record>
